{
  "schema_version": "1.0.0",
  "workflow_id": "wf_01",
  "correlation_id": "corr_01",
  "causation_id": "evt_01",
  "timestamp_utc": "2026-04-08T10:15:30Z",
  "originator": {
    "type": "agent",
    "id": "planner_agent"
  },
  "environment": "paper",
  "operating_mode": "MODE-001",
  "contract_type": "WorkflowIntent",
  "payload": {
    "objective": "Review EURUSD trade idea",
    "workflow_type": "trade_review",
    "trigger_type": "user_action",
    "requested_scope": {
      "symbol_group": [
        "EURUSD"
      ]
    }
  }
}